ID,auditID,auditType,auditDate,auditor,findings,status,lastRun
550e8400-e29b-41d4-a716-446655440000,AUD-2025-001,Security Compliance,2025-01-10,John Mathews,"All access logs validated. Minor deviations found in user role assignments.",Completed,2025-01-10T14:35:20Z
550e8400-e29b-41d4-a716-446655440001,AUD-2025-002,Process Audit,2025-02-05,Sophia Williams,"Inefficiencies in PO approval workflow. Recommended automation.",Pending Review,2025-02-05T10:12:55Z
550e8400-e29b-41d4-a716-446655440002,AUD-2025-003,Data Quality Check,2025-03-15,Rahul Sharma,"Missing vendor emails detected. Suggested mandatory field validation.",In Progress,2025-03-15T09:45:12Z
550e8400-e29b-41d4-a716-446655440003,AUD-2025-004,System Performance Audit,2025-04-01,Emily Turner,"System shows delay in GR posting under heavy load.",Completed,2025-04-01T17:22:40Z
550e8400-e29b-41d4-a716-446655440004,AUD-2025-005,Security Breach Review,2025-04-20,Daniel Kim,"Unauthorized login attempts detected. Password policy updated.",Critical,2025-04-20T19:05:33Z
